{
  "eligibility": {
    "defaults": {
      "tier1_min": 0,
      "tier2_min": 0,
      "tier3_min": 0
    },
    "map": {
      "homeless_required": "customer.is_homeless_verified",
      "tier1_any_of": "customer.tier1_min",
      "veteran_required": "customer.is_veteran_verified"
    }
  },
  "meta": {
    "description": "Customer services qualification & eligibility.",
    "effective_on": "2026-01-01",
    "notes": [
      "Policy requires Customers complete the vetting process.",
      "Customer status verified & needs profile assessment completed.",
      "Anything not covered requires Governance level approval.",
      "Tier 1 - physiological needs.",
      "Tier 2 - sociological needs.",
      "Teir 3 - pyscological needs."
    ],
    "policy_key": "customer",
    "schema_version": 1,
    "status": "draft",
    "title": "Customer Eligibility & Needs Profile",
    "version": 1
  },
  "needs_tiers": {
    "tier1": [
      "food",
      "hygiene",
      "health",
      "housing",
      "clothing"
    ],
    "tier2": [
      "income",
      "employment",
      "transportation",
      "education"
    ],
    "tier3": [
      "family",
      "peergroup",
      "tech"
    ]
  },
  "veteran_verification": {
    "methods": [
      "dd214",
      "va_id",
      "state_dl_veteran",
      "other"
    ]
  }
}
